Tipo,Rotulo,Num_Inicio,Num_Final,Texto,urn
"ART","decreto_lei_4657_19420904, Art. 21.",159,164,"[ Lei de Introdução às normas do Direito Brasileiro.(Ementa com redação dada pela Lei nº 12.376, de 30.12.2010) | ] Art. 21. A decisão que, nas esferas administrativa, controladora ou judicial, decretar a invalidação de ato, contrato, ajuste, processo ou norma administrativa deverá indicar de modo expresso suas consequências jurídicas e administrativas. Parágrafo único. A decisão a que se refere o caput deste artigo deverá, quando for o caso, indicar as condições para que a regularização ocorra de modo proporcional e equânime e sem prejuízo aos interesses gerais, não se podendo impor aos sujeitos atingidos ônus ou perdas que, em função das peculiaridades do caso, sejam anormais ou excessivos. (Artigo acrescido pela Lei nº 13.655, de 25.4.2018)",urn:lex:br:federal:decreto.lei:1942-09-04;4657!art21
"ART","decreto_lei_4657_19420904, Art. 22.",165,174,"[ Lei de Introdução às normas do Direito Brasileiro.(Ementa com redação dada pela Lei nº 12.376, de 30.12.2010) | ] Art. 22. Na interpretação de normas sobre gestão pública, serão considerados os obstáculos e as dificuldades reais do gestor e as exigências das políticas públicas a seu cargo, sem prejuízo dos direitos dos administrados. § 1º Em decisão sobre regularidade de conduta ou validade de ato, contrato, ajuste, processo ou norma administrativa, serão consideradas as circunstâncias práticas que houverem imposto, limitado ou condicionado a ação do agente. § 2º Na aplicação de sanções, serão consideradas a natureza e a gravidade da infração cometida, os danos que dela provierem para a administração pública, as circunstâncias agravantes ou atenuantes e os antecedentes do agente. § 3º As sanções aplicadas ao agente serão levadas em conta na dosimetria das demais sanções de mesma natureza e relativas ao mesmo fato. (Artigo acrescido pela Lei nº 13.655, de 25.4.2018)",urn:lex:br:federal:decreto.lei:1942-09-04;4657!art22
"ART","decreto_lei_4657_19420904, Art. 23.",175,180,"[ Lei de Introdução às normas do Direito Brasileiro.(Ementa com redação dada pela Lei nº 12.376, de 30.12.2010) | ] Art. 23. A decisão administrativa, controladora ou judicial que estabelecer interpretação ou orientação nova sobre norma de conteúdo indeterminado, impondo novo dever ou novo condicionamento de direito, deverá prever regime de transição quando indispensável para que o novo dever ou condicionamento de direito seja cumprido de modo proporcional, equânime e eficiente e sem prejuízo aos interesses gerais. Parágrafo único. (VETADO). (Artigo acrescido pela Lei nº 13.655, de 25.4.2018)",urn:lex:br:federal:decreto.lei:1942-09-04;4657!art23
"ART","decreto_lei_4657_19420904, Art. 24.",181,186,"[ Lei de Introdução às normas do Direito Brasileiro.(Ementa com redação dada pela Lei nº 12.376, de 30.12.2010) | ] Art. 24. A revisão, nas esferas administrativa, controladora ou judicial, quanto à validade de ato, contrato, ajuste, processo ou norma administrativa cuja produção já se houver completado levará em conta as orientações gerais da época, sendo vedado que, com base em mudança posterior de orientação geral, se declarem inválidas situações plenamente constituídas. Parágrafo único. Consideram-se orientações gerais as interpretações e especificações contidas em atos públicos de caráter geral ou em jurisprudência judicial ou administrativa majoritária, e ainda as adotadas por prática administrativa reiterada e de amplo conhecimento público. (Artigo acrescido pela Lei nº 13.655, de 25.4.2018)",urn:lex:br:federal:decreto.lei:1942-09-04;4657!art24
"ART","decreto_lei_4657_19420904, Art. 25.",187,190,"[ Lei de Introdução às normas do Direito Brasileiro.(Ementa com redação dada pela Lei nº 12.376, de 30.12.2010) | ] Art. 25. (VETADO na Lei nº 13.655, de 25.4.2018)",urn:lex:br:federal:decreto.lei:1942-09-04;4657!art25
"ART","decreto_lei_4657_19420904, Art. 26.",191,206,"[ Lei de Introdução às normas do Direito Brasileiro.(Ementa com redação dada pela Lei nº 12.376, de 30.12.2010) | ] Art. 26. Para eliminar irregularidade, incerteza jurídica ou situação contenciosa na aplicação do direito público, inclusive no caso de expedição de licença, a autoridade administrativa poderá, após oitiva do órgão jurídico e, quando for o caso, após realização de consulta pública, e presentes razões de relevante interesse geral, celebrar compromisso com os interessados, observada a legislação aplicável, o qual só produzirá efeitos a partir de sua publicação oficial. § 1º O compromisso referido no caput deste artigo: I – buscará solução jurídica proporcional, equânime, eficiente e compatível com os interesses gerais; II – (VETADO); III – não poderá conferir desoneração permanente de dever ou condicionamento de direito reconhecidos por orientação geral; IV – deverá prever com clareza as obrigações das partes, o prazo para seu cumprimento e as sanções aplicáveis em caso de descumprimento. § 2º (VETADO). (Artigo acrescido pela Lei nº 13.655, de 25.4.2018)",urn:lex:br:federal:decreto.lei:1942-09-04;4657!art26
"ART","decreto_lei_4657_19420904, Art. 27.",207,214,"[ Lei de Introdução às normas do Direito Brasileiro.(Ementa com redação dada pela Lei nº 12.376, de 30.12.2010) | ] Art. 27. A decisão do processo, nas esferas administrativa, controladora ou judicial, poderá impor compensação por benefícios indevidos ou prejuízos anormais ou injustos resultantes do processo ou da conduta dos envolvidos. § 1º A decisão sobre a compensação será motivada, ouvidas previamente as partes sobre seu cabimento, sua forma e, se for o caso, seu valor. § 2º Para prevenir ou regular a compensação, poderá ser celebrado compromisso processual entre os envolvidos. (Artigo acrescido pela Lei nº 13.655, de 25.4.2018)",urn:lex:br:federal:decreto.lei:1942-09-04;4657!art27
"ART","decreto_lei_4657_19420904, Art. 28.",215,224,"[ Lei de Introdução às normas do Direito Brasileiro.(Ementa com redação dada pela Lei nº 12.376, de 30.12.2010) | ] Art. 28. O agente público responderá pessoalmente por suas decisões ou opiniões técnicas em caso de dolo ou erro grosseiro. § 1º (VETADO). § 2º (VETADO). § 3º (VETADO). (Artigo acrescido pela Lei nº 13.655, de 25.4.2018)",urn:lex:br:federal:decreto.lei:1942-09-04;4657!art28
"ART","decreto_lei_4657_19420904, Art. 29.",225,232,"[ Lei de Introdução às normas do Direito Brasileiro.(Ementa com redação dada pela Lei nº 12.376, de 30.12.2010) | ] Art. 29. Em qualquer órgão ou Poder, a edição de atos normativos por autoridade administrativa, salvo os de mera organização interna, poderá ser precedida de consulta pública para manifestação de interessados, preferencialmente por meio eletrônico, a qual será considerada na decisão. § 1º A convocação conterá a minuta do ato normativo e fixará o prazo e demais condições da consulta pública, observadas as normas legais e regulamentares específicas, se houver. § 2º (VETADO). (Artigo acrescido pela Lei nº 13.655, de 25.4.2018, publicada no DOU de 26.4.2018, em vigor 180 dias após a publicação)",urn:lex:br:federal:decreto.lei:1942-09-04;4657!art29
"ART","decreto_lei_4657_19420904, Art. 30.",233,238,"[ Lei de Introdução às normas do Direito Brasileiro.(Ementa com redação dada pela Lei nº 12.376, de 30.12.2010) | ] Art. 30. As autoridades públicas devem atuar para aumentar a segurança jurídica na aplicação das normas, inclusive por meio de regulamentos, súmulas administrativas e respostas a consultas. Parágrafo único. Os instrumentos previstos no caput deste artigo terão caráter vinculante em relação ao órgão ou entidade a que se destinam, até ulterior revisão. (Artigo acrescido pela Lei nº 13.655, de 25.4.2018)",urn:lex:br:federal:decreto.lei:1942-09-04;4657!art30
"INC","decreto_lei_4657_19420904, Art. 26., § 1º, Inciso I",195,196,"[ Lei de Introdução às normas do Direito Brasileiro.(Ementa com redação dada pela Lei nº 12.376, de 30.12.2010) | Art. 26. § 1º O compromisso referido no caput deste artigo: ] I – buscará solução jurídica proporcional, equânime, eficiente e compatível com os interesses gerais;",urn:lex:br:federal:decreto.lei:1942-09-04;4657!art26_par1_inc1
"INC","decreto_lei_4657_19420904, Art. 26., § 1º, Inciso II",197,198,"[ Lei de Introdução às normas do Direito Brasileiro.(Ementa com redação dada pela Lei nº 12.376, de 30.12.2010) | Art. 26. § 1º O compromisso referido no caput deste artigo: ] II – (VETADO);",urn:lex:br:federal:decreto.lei:1942-09-04;4657!art26_par1_inc2
"INC","decreto_lei_4657_19420904, Art. 26., § 1º, Inciso III",199,200,"[ Lei de Introdução às normas do Direito Brasileiro.(Ementa com redação dada pela Lei nº 12.376, de 30.12.2010) | Art. 26. § 1º O compromisso referido no caput deste artigo: ] III – não poderá conferir desoneração permanente de dever ou condicionamento de direito reconhecidos por orientação geral;",urn:lex:br:federal:decreto.lei:1942-09-04;4657!art26_par1_inc3
"INC","decreto_lei_4657_19420904, Art. 26., § 1º, Inciso IV",201,202,"[ Lei de Introdução às normas do Direito Brasileiro.(Ementa com redação dada pela Lei nº 12.376, de 30.12.2010) | Art. 26. § 1º O compromisso referido no caput deste artigo: ] IV – deverá prever com clareza as obrigações das partes, o prazo para seu cumprimento e as sanções aplicáveis em caso de descumprimento.",urn:lex:br:federal:decreto.lei:1942-09-04;4657!art26_par1_inc4
"ALI","decreto_lei_4657_19420904, Art. 15., caput, Alínea a",117,118,"[ Lei de Introdução às normas do Direito Brasileiro.(Ementa com redação dada pela Lei nº 12.376, de 30.12.2010) | Art. 15. Será executada no Brasil a sentença proferida no estrangeiro, que reuna os seguintes requisitos: ] a) haver sido proferida por juiz competente;",urn:lex:br:federal:decreto.lei:1942-09-04;4657!art15_cpt_ali1
"ALI","decreto_lei_4657_19420904, Art. 15., caput, Alínea b",119,120,"[ Lei de Introdução às normas do Direito Brasileiro.(Ementa com redação dada pela Lei nº 12.376, de 30.12.2010) | Art. 15. Será executada no Brasil a sentença proferida no estrangeiro, que reuna os seguintes requisitos: ] b) terem sido os partes citadas ou haver-se legalmente verificado à revelia;",urn:lex:br:federal:decreto.lei:1942-09-04;4657!art15_cpt_ali2
"ALI","decreto_lei_4657_19420904, Art. 15., caput, Alínea c",121,122,"[ Lei de Introdução às normas do Direito Brasileiro.(Ementa com redação dada pela Lei nº 12.376, de 30.12.2010) | Art. 15. Será executada no Brasil a sentença proferida no estrangeiro, que reuna os seguintes requisitos: ] c) ter passado em julgado e estar revestida das formalidades necessárias para a execução no lugar em que foi proferida;",urn:lex:br:federal:decreto.lei:1942-09-04;4657!art15_cpt_ali3
"ALI","decreto_lei_4657_19420904, Art. 15., caput, Alínea d",123,124,"[ Lei de Introdução às normas do Direito Brasileiro.(Ementa com redação dada pela Lei nº 12.376, de 30.12.2010) | Art. 15. Será executada no Brasil a sentença proferida no estrangeiro, que reuna os seguintes requisitos: ] d) estar traduzida por intérprete autorizado;",urn:lex:br:federal:decreto.lei:1942-09-04;4657!art15_cpt_ali4
"ALI","decreto_lei_4657_19420904, Art. 15., caput, Alínea e",125,126,"[ Lei de Introdução às normas do Direito Brasileiro.(Ementa com redação dada pela Lei nº 12.376, de 30.12.2010) | Art. 15. Será executada no Brasil a sentença proferida no estrangeiro, que reuna os seguintes requisitos: ] e) ter sido homologada pelo Supremo Tribunal Federal. (Vide art. 105, I, i, da Constituição Federal, com redação dada pela Emenda Constitucional nº 45, de 2004)",urn:lex:br:federal:decreto.lei:1942-09-04;4657!art15_cpt_ali5
