Tipo,Rotulo,Num_Inicio,Num_Final,Texto,urn
"ART","decreto_11713_2023, Art. 9º",175,178,"[ Institui a Estratégia Nacional de Escolas Conectadas. | ] Art. 9º Compete à Casa Civil da Presidência da República acompanhar a implementação da Enec.",urn:lex:br:federal:decreto:2023-09-26;11713!art9
"ART","decreto_11713_2023, Art. 10.",179,182,"[ Institui a Estratégia Nacional de Escolas Conectadas. | ] Art. 10. Compete ao Ministério das Comunicações propor ao Comitê Executivo parâmetros para a escolha das soluções de conectividade mais eficientes, com o apoio técnico da Anatel, da Telebras e da RNP, com avaliação das alternativas tecnológicas e comerciais disponíveis que melhor se adaptem às diferentes situações dos estabelecimentos de ensino da rede pública da educação básica que serão atendidos no âmbito da Enec.",urn:lex:br:federal:decreto:2023-09-26;11713!art10
"ART","decreto_11713_2023, Art. 11.",183,186,"[ Institui a Estratégia Nacional de Escolas Conectadas. | ] Art. 11. Compete ao Ministério da Educação articular e coordenar as ações necessárias à consecução dos objetivos da Enec junto aos Estados, ao Distrito Federal e aos Municípios.",urn:lex:br:federal:decreto:2023-09-26;11713!art11
"ART","decreto_11713_2023, Art. 12.",187,202,"[ Institui a Estratégia Nacional de Escolas Conectadas. | ] Art. 12. Os Estados, o Distrito Federal e os Municípios poderão aderir voluntariamente à Enec por meio da celebração de ato com o Ministério da Educação. § 1º No ato de adesão à Enec, o ente federativo deverá: I – apresentar diagnóstico que contenha informações sobre a situação atualizada, as ações, as políticas e os programas existentes para a conectividade para fins educacionais, conforme previsto no art. 2º; e II – firmar termo de compromisso, por meio do qual se comprometerá a: a) atender ao disposto no art. 3º e aos parâmetros técnicos definidos pelo Comitê Executivo nas suas políticas de conectividade para fins educacionais; e b) anuir com a execução de ações para garantia da conectividade para fins educacionais nos seus estabelecimentos de ensino da rede pública da educação básica por meio de programas apoiados tecnicamente ou financeiramente pelo Governo federal. § 2º Os entes federativos que se vincularem à Enec serão priorizados nas ações e nos programas do Governo federal relacionados à conectividade de estabelecimentos de ensino da rede pública da educação básica.",urn:lex:br:federal:decreto:2023-09-26;11713!art12
"ART","decreto_11713_2023, Art. 13.",203,210,"[ Institui a Estratégia Nacional de Escolas Conectadas. | ] Art. 13. Os entes federativos que aderirem à Enec deverão: I – instalar e manter em funcionamento o sistema denominado Medidor Educação Conectada ou outro que venha a ser indicado pelo Ministério da Educação; e II – disponibilizar as informações necessárias ao monitoramento de que trata este Decreto.",urn:lex:br:federal:decreto:2023-09-26;11713!art13
"ART","decreto_11713_2023, Art. 14.",211,214,"[ Institui a Estratégia Nacional de Escolas Conectadas. | ] Art. 14. A implementação da Enec poderá abranger a conectividade de equipamentos sociais relacionados a outras atividades, especialmente a saúde pública.",urn:lex:br:federal:decreto:2023-09-26;11713!art14
"ART","decreto_11713_2023, Art. 15.",215,230,"[ Institui a Estratégia Nacional de Escolas Conectadas. | ] Art. 15. Para o cumprimento do disposto neste Decreto, o Ministério da Educação ou o Ministério das Comunicações poderá celebrar, dentre outros: I – contratos de gestão; II – termos de parceria; III – acordos de cooperação; IV – termos de fomento; ou V – termos de colaboração. Parágrafo único. A celebração dos instrumentos de que trata o caput observará o disposto na Lei nº 9.637, de 15 de maio de 1998, na Lei nº 9.790, de 23 de março de 1999, na Lei nº 13.019, de 31 de julho de 2014, e nas demais normas aplicáveis às espécies.",urn:lex:br:federal:decreto:2023-09-26;11713!art15
"ART","decreto_11713_2023, Art. 16.",231,234,"[ Institui a Estratégia Nacional de Escolas Conectadas. | ] Art. 16. Ficam revogados os art. 8º e art. 9º do Decreto nº 9.204, de 23 de novembro de 2017.",urn:lex:br:federal:decreto:2023-09-26;11713!art16
"ART","decreto_11713_2023, Art. 17.",235,238,"[ Institui a Estratégia Nacional de Escolas Conectadas. | ] Art. 17. Este Decreto entra em vigor na data de sua publicação.",urn:lex:br:federal:decreto:2023-09-26;11713!art17
"INC","decreto_11713_2023, Art. 1º, Parágrafo único., Inciso I",5,12,"[ Institui a Estratégia Nacional de Escolas Conectadas. | Art. 1º Parágrafo único. A Enec considerará as dimensões de infraestrutura e equipamentos previstas: ] I – nos seguintes dispositivos da Lei nº 9.394, de 20 de dezembro de 1996: a) inciso IX do caput do art. 3º; b) inciso XII do caput do art. 4º; e c) art. 8º;",urn:lex:br:federal:decreto:2023-09-26;11713!art1_par1u_inc1
"INC","decreto_11713_2023, Art. 1º, Parágrafo único., Inciso II",13,14,"[ Institui a Estratégia Nacional de Escolas Conectadas. | Art. 1º Parágrafo único. A Enec considerará as dimensões de infraestrutura e equipamentos previstas: ] II – no § 2º do art. 1º da Lei nº 9.998, de 17 de agosto de 2000;",urn:lex:br:federal:decreto:2023-09-26;11713!art1_par1u_inc2
"INC","decreto_11713_2023, Art. 1º, Parágrafo único., Inciso III",15,16,"[ Institui a Estratégia Nacional de Escolas Conectadas. | Art. 1º Parágrafo único. A Enec considerará as dimensões de infraestrutura e equipamentos previstas: ] III – nas estratégias 7.15 e 7.20 da meta 7 do Anexo à Lei nº 13.005, de 25 de junho de 2014;",urn:lex:br:federal:decreto:2023-09-26;11713!art1_par1u_inc3
"INC","decreto_11713_2023, Art. 1º, Parágrafo único., Inciso IV",17,18,"[ Institui a Estratégia Nacional de Escolas Conectadas. | Art. 1º Parágrafo único. A Enec considerará as dimensões de infraestrutura e equipamentos previstas: ] IV – na Lei nº 14.172, de 10 de junho de 2021;",urn:lex:br:federal:decreto:2023-09-26;11713!art1_par1u_inc4
"INC","decreto_11713_2023, Art. 1º, Parágrafo único., Inciso V",19,20,"[ Institui a Estratégia Nacional de Escolas Conectadas. | Art. 1º Parágrafo único. A Enec considerará as dimensões de infraestrutura e equipamentos previstas: ] V – na Lei nº 14.180, de 1º de julho de 2021; e",urn:lex:br:federal:decreto:2023-09-26;11713!art1_par1u_inc5
"INC","decreto_11713_2023, Art. 1º, Parágrafo único., Inciso VI",21,22,"[ Institui a Estratégia Nacional de Escolas Conectadas. | Art. 1º Parágrafo único. A Enec considerará as dimensões de infraestrutura e equipamentos previstas: ] VI – no inciso VI do caput do art. 2º da Lei nº 14.533, de 11 de janeiro de 2023.",urn:lex:br:federal:decreto:2023-09-26;11713!art1_par1u_inc6
"INC","decreto_11713_2023, Art. 2º, caput, Inciso I",27,28,"[ Institui a Estratégia Nacional de Escolas Conectadas. | Art. 2º A Enec visa conjugar esforços de órgãos e entidades da União, dos Estados, do Distrito Federal e dos Municípios, de escolas, do setor empresarial e da sociedade civil para a consecução dos seguintes objetivos: ] I – promover a universalização da conectividade de estabelecimentos de ensino da rede pública da educação básica;",urn:lex:br:federal:decreto:2023-09-26;11713!art2_cpt_inc1
"INC","decreto_11713_2023, Art. 2º, caput, Inciso II",29,30,"[ Institui a Estratégia Nacional de Escolas Conectadas. | Art. 2º A Enec visa conjugar esforços de órgãos e entidades da União, dos Estados, do Distrito Federal e dos Municípios, de escolas, do setor empresarial e da sociedade civil para a consecução dos seguintes objetivos: ] II – fomentar a equidade de oportunidades de acesso às tecnologias digitais no processo de ensino e aprendizagem; e",urn:lex:br:federal:decreto:2023-09-26;11713!art2_cpt_inc2
"INC","decreto_11713_2023, Art. 2º, caput, Inciso III",31,32,"[ Institui a Estratégia Nacional de Escolas Conectadas. | Art. 2º A Enec visa conjugar esforços de órgãos e entidades da União, dos Estados, do Distrito Federal e dos Municípios, de escolas, do setor empresarial e da sociedade civil para a consecução dos seguintes objetivos: ] III – contribuir com a aprendizagem digital e com o aperfeiçoamento da gestão por meio da ampliação do acesso à internet e às tecnologias digitais pelos estudantes, pelos professores e pelos gestores da rede pública de educação básica.",urn:lex:br:federal:decreto:2023-09-26;11713!art2_cpt_inc3
"INC","decreto_11713_2023, Art. 3º, caput, Inciso I",37,44,"[ Institui a Estratégia Nacional de Escolas Conectadas. | Art. 3º A conectividade de estabelecimentos de ensino da rede pública da educação básica contemplará: ] I – conexão em alta velocidade que permita: a) a realização de atividades pedagógicas e administrativas online; b) o uso de recursos educacionais e de gestão; e c) o acesso a áudios, vídeos, jogos e plataformas de streaming;",urn:lex:br:federal:decreto:2023-09-26;11713!art3_cpt_inc1
"INC","decreto_11713_2023, Art. 3º, caput, Inciso II",45,58,"[ Institui a Estratégia Nacional de Escolas Conectadas. | Art. 3º A conectividade de estabelecimentos de ensino da rede pública da educação básica contemplará: ] II – disponibilidade de rede sem fio no ambiente escolar, composto por: a) salas de aula; b) bibliotecas; c) laboratórios; d) salas de professores; e) áreas comuns; e f) áreas administrativas;",urn:lex:br:federal:decreto:2023-09-26;11713!art3_cpt_inc2
"INC","decreto_11713_2023, Art. 3º, caput, Inciso III",59,60,"[ Institui a Estratégia Nacional de Escolas Conectadas. | Art. 3º A conectividade de estabelecimentos de ensino da rede pública da educação básica contemplará: ] III – disponibilidade de ferramentas para seu monitoramento constante e para garantia da segurança da informação; e",urn:lex:br:federal:decreto:2023-09-26;11713!art3_cpt_inc3
"INC","decreto_11713_2023, Art. 3º, caput, Inciso IV",61,62,"[ Institui a Estratégia Nacional de Escolas Conectadas. | Art. 3º A conectividade de estabelecimentos de ensino da rede pública da educação básica contemplará: ] IV – disponibilidade de equipamentos e dispositivos de acesso à internet adequados para fins administrativos e educacionais.",urn:lex:br:federal:decreto:2023-09-26;11713!art3_cpt_inc4
"INC","decreto_11713_2023, Art. 3º, Parágrafo único., Inciso I",65,66,"[ Institui a Estratégia Nacional de Escolas Conectadas. | Art. 3º Parágrafo único. Para garantir a conectividade de que trata o caput, serão adotadas as seguintes ações, sem prejuízo da adoção de medidas adicionais: ] I – disponibilização de energia elétrica por intermédio do acesso à rede pública de energia ou da instalação de tecnologias de energias renováveis;",urn:lex:br:federal:decreto:2023-09-26;11713!art3_par1u_inc1
"INC","decreto_11713_2023, Art. 3º, Parágrafo único., Inciso II",67,68,"[ Institui a Estratégia Nacional de Escolas Conectadas. | Art. 3º Parágrafo único. Para garantir a conectividade de que trata o caput, serão adotadas as seguintes ações, sem prejuízo da adoção de medidas adicionais: ] II – expansão da conexão à internet de alta velocidade por meio de implantação e manutenção de rede de fibra ótica, de conexão via satélite ou de outros serviços de acesso à internet de alta velocidade;",urn:lex:br:federal:decreto:2023-09-26;11713!art3_par1u_inc2
"INC","decreto_11713_2023, Art. 3º, Parágrafo único., Inciso III",69,70,"[ Institui a Estratégia Nacional de Escolas Conectadas. | Art. 3º Parágrafo único. Para garantir a conectividade de que trata o caput, serão adotadas as seguintes ações, sem prejuízo da adoção de medidas adicionais: ] III – contratação de serviços de acesso à internet de alta velocidade;",urn:lex:br:federal:decreto:2023-09-26;11713!art3_par1u_inc3
"INC","decreto_11713_2023, Art. 3º, Parágrafo único., Inciso IV",71,72,"[ Institui a Estratégia Nacional de Escolas Conectadas. | Art. 3º Parágrafo único. Para garantir a conectividade de que trata o caput, serão adotadas as seguintes ações, sem prejuízo da adoção de medidas adicionais: ] IV – disponibilização de rede sem fio para acesso à internet no ambiente escolar;",urn:lex:br:federal:decreto:2023-09-26;11713!art3_par1u_inc4
"INC","decreto_11713_2023, Art. 3º, Parágrafo único., Inciso V",73,74,"[ Institui a Estratégia Nacional de Escolas Conectadas. | Art. 3º Parágrafo único. Para garantir a conectividade de que trata o caput, serão adotadas as seguintes ações, sem prejuízo da adoção de medidas adicionais: ] V – disponibilização de equipamentos e dispositivos eletrônicos de acesso à internet;",urn:lex:br:federal:decreto:2023-09-26;11713!art3_par1u_inc5
"INC","decreto_11713_2023, Art. 3º, Parágrafo único., Inciso VI",75,76,"[ Institui a Estratégia Nacional de Escolas Conectadas. | Art. 3º Parágrafo único. Para garantir a conectividade de que trata o caput, serão adotadas as seguintes ações, sem prejuízo da adoção de medidas adicionais: ] VI – suporte técnico, monitoramento e manutenção dos dispositivos eletrônicos e das redes sem fio; e",urn:lex:br:federal:decreto:2023-09-26;11713!art3_par1u_inc6
"INC","decreto_11713_2023, Art. 3º, Parágrafo único., Inciso VII",77,78,"[ Institui a Estratégia Nacional de Escolas Conectadas. | Art. 3º Parágrafo único. Para garantir a conectividade de que trata o caput, serão adotadas as seguintes ações, sem prejuízo da adoção de medidas adicionais: ] VII – estímulo ao desenvolvimento de soluções inovadoras que auxiliem na consecução dos objetivos da Enec.",urn:lex:br:federal:decreto:2023-09-26;11713!art3_par1u_inc7
"INC","decreto_11713_2023, Art. 6º, § 1º, Inciso I",93,94,"[ Institui a Estratégia Nacional de Escolas Conectadas. | Art. 6º § 1º Ao Comitê Executivo compete: ] I – articular as políticas, os planos, os programas, as iniciativas e a disponibilização de recursos relacionados à conectividade de estabelecimentos de ensino da rede pública da educação básica;",urn:lex:br:federal:decreto:2023-09-26;11713!art6_par1_inc1
"INC","decreto_11713_2023, Art. 6º, § 1º, Inciso II",95,96,"[ Institui a Estratégia Nacional de Escolas Conectadas. | Art. 6º § 1º Ao Comitê Executivo compete: ] II – estabelecer metas para a consecução dos objetivos da Enec;",urn:lex:br:federal:decreto:2023-09-26;11713!art6_par1_inc2
"INC","decreto_11713_2023, Art. 6º, § 1º, Inciso III",97,98,"[ Institui a Estratégia Nacional de Escolas Conectadas. | Art. 6º § 1º Ao Comitê Executivo compete: ] III – definir e publicizar parâmetros técnicos para contratação, gestão e manutenção dos serviços de fornecimento de energia elétrica e de acesso à internet;",urn:lex:br:federal:decreto:2023-09-26;11713!art6_par1_inc3
"INC","decreto_11713_2023, Art. 6º, § 1º, Inciso IV",99,100,"[ Institui a Estratégia Nacional de Escolas Conectadas. | Art. 6º § 1º Ao Comitê Executivo compete: ] IV – definir e publicizar referenciais técnicos sobre a infraestrutura interna para distribuição do sinal de internet nos estabelecimentos de ensino da rede pública da educação básica;",urn:lex:br:federal:decreto:2023-09-26;11713!art6_par1_inc4
"INC","decreto_11713_2023, Art. 6º, § 1º, Inciso V",101,102,"[ Institui a Estratégia Nacional de Escolas Conectadas. | Art. 6º § 1º Ao Comitê Executivo compete: ] V – definir critérios e mecanismos de monitoramento da qualidade da conexão nos estabelecimentos de ensino da rede pública da educação básica;",urn:lex:br:federal:decreto:2023-09-26;11713!art6_par1_inc5
"INC","decreto_11713_2023, Art. 6º, § 1º, Inciso VI",103,104,"[ Institui a Estratégia Nacional de Escolas Conectadas. | Art. 6º § 1º Ao Comitê Executivo compete: ] VI – monitorar as iniciativas e avaliar os resultados das ações da Enec; e",urn:lex:br:federal:decreto:2023-09-26;11713!art6_par1_inc6
"INC","decreto_11713_2023, Art. 6º, § 1º, Inciso VII",105,106,"[ Institui a Estratégia Nacional de Escolas Conectadas. | Art. 6º § 1º Ao Comitê Executivo compete: ] VII – monitorar a conectividade de estabelecimentos de ensino da rede pública da educação básica.",urn:lex:br:federal:decreto:2023-09-26;11713!art6_par1_inc7
"INC","decreto_11713_2023, Art. 7º, caput, Inciso I",113,120,"[ Institui a Estratégia Nacional de Escolas Conectadas. | Art. 7º O Comitê Executivo é composto por: ] I – dois representantes dos seguintes órgãos: a) Ministério da Educação, um dos quais o coordenará; b) Casa Civil da Presidência da República; e c) Ministério das Comunicações; e",urn:lex:br:federal:decreto:2023-09-26;11713!art7_cpt_inc1
"INC","decreto_11713_2023, Art. 7º, caput, Inciso II",121,136,"[ Institui a Estratégia Nacional de Escolas Conectadas. | Art. 7º O Comitê Executivo é composto por: ] II – um representante dos seguintes órgãos e entidades: a) Ministério da Ciência, Tecnologia e Inovação; b) Ministério de Minas e Energia; c) Agência Nacional de Telecomunicações - Anatel; d) Fundo Nacional de Desenvolvimento da Educação - FNDE; e) Telecomunicações Brasileiras S.A. - Telebras; f) Banco Nacional de Desenvolvimento Econômico e Social - BNDES; e g) Rede Nacional de Ensino e Pesquisa - RNP.",urn:lex:br:federal:decreto:2023-09-26;11713!art7_cpt_inc2
"INC","decreto_11713_2023, Art. 7º, § 4º, Inciso I",145,146,"[ Institui a Estratégia Nacional de Escolas Conectadas. | Art. 7º § 4º O Comitê Executivo poderá instituir grupos de trabalho temporários com o objetivo de: ] I – analisar e articular soluções para assuntos específicos relacionados à matéria; e",urn:lex:br:federal:decreto:2023-09-26;11713!art7_par4_inc1
"INC","decreto_11713_2023, Art. 7º, § 4º, Inciso II",147,148,"[ Institui a Estratégia Nacional de Escolas Conectadas. | Art. 7º § 4º O Comitê Executivo poderá instituir grupos de trabalho temporários com o objetivo de: ] II – desenvolver projetos e atividades acerca da conectividade por qualquer um de seus membros.",urn:lex:br:federal:decreto:2023-09-26;11713!art7_par4_inc2
"INC","decreto_11713_2023, Art. 7º, § 7º, Inciso I",155,156,"[ Institui a Estratégia Nacional de Escolas Conectadas. | Art. 7º § 7º O quórum de reunião do Comitê Executivo é de maioria absoluta, observada a obrigatoriedade de presença de um representante dos seguintes órgãos: ] I – Casa Civil da Presidência da República;",urn:lex:br:federal:decreto:2023-09-26;11713!art7_par7_inc1
"INC","decreto_11713_2023, Art. 7º, § 7º, Inciso II",157,158,"[ Institui a Estratégia Nacional de Escolas Conectadas. | Art. 7º § 7º O quórum de reunião do Comitê Executivo é de maioria absoluta, observada a obrigatoriedade de presença de um representante dos seguintes órgãos: ] II – Ministério das Comunicações; e",urn:lex:br:federal:decreto:2023-09-26;11713!art7_par7_inc2
"INC","decreto_11713_2023, Art. 7º, § 7º, Inciso III",159,160,"[ Institui a Estratégia Nacional de Escolas Conectadas. | Art. 7º § 7º O quórum de reunião do Comitê Executivo é de maioria absoluta, observada a obrigatoriedade de presença de um representante dos seguintes órgãos: ] III – Ministério da Educação.",urn:lex:br:federal:decreto:2023-09-26;11713!art7_par7_inc3
"INC","decreto_11713_2023, Art. 12., § 1º, Inciso I",191,192,"[ Institui a Estratégia Nacional de Escolas Conectadas. | Art. 12. § 1º No ato de adesão à Enec, o ente federativo deverá: ] I – apresentar diagnóstico que contenha informações sobre a situação atualizada, as ações, as políticas e os programas existentes para a conectividade para fins educacionais, conforme previsto no art. 2º; e",urn:lex:br:federal:decreto:2023-09-26;11713!art12_par1_inc1
"INC","decreto_11713_2023, Art. 12., § 1º, Inciso II",193,198,"[ Institui a Estratégia Nacional de Escolas Conectadas. | Art. 12. § 1º No ato de adesão à Enec, o ente federativo deverá: ] II – firmar termo de compromisso, por meio do qual se comprometerá a: a) atender ao disposto no art. 3º e aos parâmetros técnicos definidos pelo Comitê Executivo nas suas políticas de conectividade para fins educacionais; e b) anuir com a execução de ações para garantia da conectividade para fins educacionais nos seus estabelecimentos de ensino da rede pública da educação básica por meio de programas apoiados tecnicamente ou financeiramente pelo Governo federal.",urn:lex:br:federal:decreto:2023-09-26;11713!art12_par1_inc2
"INC","decreto_11713_2023, Art. 13., caput, Inciso I",205,206,"[ Institui a Estratégia Nacional de Escolas Conectadas. | Art. 13. Os entes federativos que aderirem à Enec deverão: ] I – instalar e manter em funcionamento o sistema denominado Medidor Educação Conectada ou outro que venha a ser indicado pelo Ministério da Educação; e",urn:lex:br:federal:decreto:2023-09-26;11713!art13_cpt_inc1
"INC","decreto_11713_2023, Art. 13., caput, Inciso II",207,208,"[ Institui a Estratégia Nacional de Escolas Conectadas. | Art. 13. Os entes federativos que aderirem à Enec deverão: ] II – disponibilizar as informações necessárias ao monitoramento de que trata este Decreto.",urn:lex:br:federal:decreto:2023-09-26;11713!art13_cpt_inc2
"INC","decreto_11713_2023, Art. 15., caput, Inciso I",217,218,"[ Institui a Estratégia Nacional de Escolas Conectadas. | Art. 15. Para o cumprimento do disposto neste Decreto, o Ministério da Educação ou o Ministério das Comunicações poderá celebrar, dentre outros: ] I – contratos de gestão;",urn:lex:br:federal:decreto:2023-09-26;11713!art15_cpt_inc1
"INC","decreto_11713_2023, Art. 15., caput, Inciso II",219,220,"[ Institui a Estratégia Nacional de Escolas Conectadas. | Art. 15. Para o cumprimento do disposto neste Decreto, o Ministério da Educação ou o Ministério das Comunicações poderá celebrar, dentre outros: ] II – termos de parceria;",urn:lex:br:federal:decreto:2023-09-26;11713!art15_cpt_inc2
"INC","decreto_11713_2023, Art. 15., caput, Inciso III",221,222,"[ Institui a Estratégia Nacional de Escolas Conectadas. | Art. 15. Para o cumprimento do disposto neste Decreto, o Ministério da Educação ou o Ministério das Comunicações poderá celebrar, dentre outros: ] III – acordos de cooperação;",urn:lex:br:federal:decreto:2023-09-26;11713!art15_cpt_inc3
"INC","decreto_11713_2023, Art. 15., caput, Inciso IV",223,224,"[ Institui a Estratégia Nacional de Escolas Conectadas. | Art. 15. Para o cumprimento do disposto neste Decreto, o Ministério da Educação ou o Ministério das Comunicações poderá celebrar, dentre outros: ] IV – termos de fomento; ou",urn:lex:br:federal:decreto:2023-09-26;11713!art15_cpt_inc4
"INC","decreto_11713_2023, Art. 15., caput, Inciso V",225,226,"[ Institui a Estratégia Nacional de Escolas Conectadas. | Art. 15. Para o cumprimento do disposto neste Decreto, o Ministério da Educação ou o Ministério das Comunicações poderá celebrar, dentre outros: ] V – termos de colaboração.",urn:lex:br:federal:decreto:2023-09-26;11713!art15_cpt_inc5
"ALI","decreto_11713_2023, Art. 1º, Parágrafo único., Inciso I, Alínea a",6,7,"[ Institui a Estratégia Nacional de Escolas Conectadas. | Art. 1º Parágrafo único. A Enec considerará as dimensões de infraestrutura e equipamentos previstas: I – nos seguintes dispositivos da : ] a) inciso IX do caput do art. 3º;",urn:lex:br:federal:decreto:2023-09-26;11713!art1_par1u_inc1_ali1
"ALI","decreto_11713_2023, Art. 1º, Parágrafo único., Inciso I, Alínea b",8,9,"[ Institui a Estratégia Nacional de Escolas Conectadas. | Art. 1º Parágrafo único. A Enec considerará as dimensões de infraestrutura e equipamentos previstas: I – nos seguintes dispositivos da : ] b) inciso XII do caput do art. 4º; e",urn:lex:br:federal:decreto:2023-09-26;11713!art1_par1u_inc1_ali2
"ALI","decreto_11713_2023, Art. 1º, Parágrafo único., Inciso I, Alínea c",10,11,"[ Institui a Estratégia Nacional de Escolas Conectadas. | Art. 1º Parágrafo único. A Enec considerará as dimensões de infraestrutura e equipamentos previstas: I – nos seguintes dispositivos da : ] c) art. 8º;",urn:lex:br:federal:decreto:2023-09-26;11713!art1_par1u_inc1_ali3
"ALI","decreto_11713_2023, Art. 3º, caput, Inciso I, Alínea a",38,39,"[ Institui a Estratégia Nacional de Escolas Conectadas. | Art. 3º A conectividade de estabelecimentos de ensino da rede pública da educação básica contemplará: I – conexão em alta velocidade que permita: ] a) a realização de atividades pedagógicas e administrativas online;",urn:lex:br:federal:decreto:2023-09-26;11713!art3_cpt_inc1_ali1
"ALI","decreto_11713_2023, Art. 3º, caput, Inciso I, Alínea b",40,41,"[ Institui a Estratégia Nacional de Escolas Conectadas. | Art. 3º A conectividade de estabelecimentos de ensino da rede pública da educação básica contemplará: I – conexão em alta velocidade que permita: ] b) o uso de recursos educacionais e de gestão; e",urn:lex:br:federal:decreto:2023-09-26;11713!art3_cpt_inc1_ali2
"ALI","decreto_11713_2023, Art. 3º, caput, Inciso I, Alínea c",42,43,"[ Institui a Estratégia Nacional de Escolas Conectadas. | Art. 3º A conectividade de estabelecimentos de ensino da rede pública da educação básica contemplará: I – conexão em alta velocidade que permita: ] c) o acesso a áudios, vídeos, jogos e plataformas de streaming;",urn:lex:br:federal:decreto:2023-09-26;11713!art3_cpt_inc1_ali3
