Tipo,Rotulo,Num_Inicio,Num_Final,Texto,urn
"ALI","decreto_11713_2023, Art. 3º, caput, Inciso II, Alínea a",46,47,"[ Institui a Estratégia Nacional de Escolas Conectadas. | Art. 3º A conectividade de estabelecimentos de ensino da rede pública da educação básica contemplará: II – disponibilidade de rede sem fio no ambiente escolar, composto por: ] a) salas de aula;",urn:lex:br:federal:decreto:2023-09-26;11713!art3_cpt_inc2_ali1
"ALI","decreto_11713_2023, Art. 3º, caput, Inciso II, Alínea b",48,49,"[ Institui a Estratégia Nacional de Escolas Conectadas. | Art. 3º A conectividade de estabelecimentos de ensino da rede pública da educação básica contemplará: II – disponibilidade de rede sem fio no ambiente escolar, composto por: ] b) bibliotecas;",urn:lex:br:federal:decreto:2023-09-26;11713!art3_cpt_inc2_ali2
"ALI","decreto_11713_2023, Art. 3º, caput, Inciso II, Alínea c",50,51,"[ Institui a Estratégia Nacional de Escolas Conectadas. | Art. 3º A conectividade de estabelecimentos de ensino da rede pública da educação básica contemplará: II – disponibilidade de rede sem fio no ambiente escolar, composto por: ] c) laboratórios;",urn:lex:br:federal:decreto:2023-09-26;11713!art3_cpt_inc2_ali3
"ALI","decreto_11713_2023, Art. 3º, caput, Inciso II, Alínea d",52,53,"[ Institui a Estratégia Nacional de Escolas Conectadas. | Art. 3º A conectividade de estabelecimentos de ensino da rede pública da educação básica contemplará: II – disponibilidade de rede sem fio no ambiente escolar, composto por: ] d) salas de professores;",urn:lex:br:federal:decreto:2023-09-26;11713!art3_cpt_inc2_ali4
"ALI","decreto_11713_2023, Art. 3º, caput, Inciso II, Alínea e",54,55,"[ Institui a Estratégia Nacional de Escolas Conectadas. | Art. 3º A conectividade de estabelecimentos de ensino da rede pública da educação básica contemplará: II – disponibilidade de rede sem fio no ambiente escolar, composto por: ] e) áreas comuns; e",urn:lex:br:federal:decreto:2023-09-26;11713!art3_cpt_inc2_ali5
"ALI","decreto_11713_2023, Art. 3º, caput, Inciso II, Alínea f",56,57,"[ Institui a Estratégia Nacional de Escolas Conectadas. | Art. 3º A conectividade de estabelecimentos de ensino da rede pública da educação básica contemplará: II – disponibilidade de rede sem fio no ambiente escolar, composto por: ] f) áreas administrativas;",urn:lex:br:federal:decreto:2023-09-26;11713!art3_cpt_inc2_ali6
"ALI","decreto_11713_2023, Art. 7º, caput, Inciso I, Alínea a",114,115,"[ Institui a Estratégia Nacional de Escolas Conectadas. | Art. 7º O Comitê Executivo é composto por: I – dois representantes dos seguintes órgãos: ] a) Ministério da Educação, um dos quais o coordenará;",urn:lex:br:federal:decreto:2023-09-26;11713!art7_cpt_inc1_ali1
"ALI","decreto_11713_2023, Art. 7º, caput, Inciso I, Alínea b",116,117,"[ Institui a Estratégia Nacional de Escolas Conectadas. | Art. 7º O Comitê Executivo é composto por: I – dois representantes dos seguintes órgãos: ] b) Casa Civil da Presidência da República; e",urn:lex:br:federal:decreto:2023-09-26;11713!art7_cpt_inc1_ali2
"ALI","decreto_11713_2023, Art. 7º, caput, Inciso I, Alínea c",118,119,"[ Institui a Estratégia Nacional de Escolas Conectadas. | Art. 7º O Comitê Executivo é composto por: I – dois representantes dos seguintes órgãos: ] c) Ministério das Comunicações; e",urn:lex:br:federal:decreto:2023-09-26;11713!art7_cpt_inc1_ali3
"ALI","decreto_11713_2023, Art. 7º, caput, Inciso II, Alínea a",122,123,"[ Institui a Estratégia Nacional de Escolas Conectadas. | Art. 7º O Comitê Executivo é composto por: II – um representante dos seguintes órgãos e entidades: ] a) Ministério da Ciência, Tecnologia e Inovação;",urn:lex:br:federal:decreto:2023-09-26;11713!art7_cpt_inc2_ali1
"ALI","decreto_11713_2023, Art. 7º, caput, Inciso II, Alínea b",124,125,"[ Institui a Estratégia Nacional de Escolas Conectadas. | Art. 7º O Comitê Executivo é composto por: II – um representante dos seguintes órgãos e entidades: ] b) Ministério de Minas e Energia;",urn:lex:br:federal:decreto:2023-09-26;11713!art7_cpt_inc2_ali2
"ALI","decreto_11713_2023, Art. 7º, caput, Inciso II, Alínea c",126,127,"[ Institui a Estratégia Nacional de Escolas Conectadas. | Art. 7º O Comitê Executivo é composto por: II – um representante dos seguintes órgãos e entidades: ] c) Agência Nacional de Telecomunicações - Anatel;",urn:lex:br:federal:decreto:2023-09-26;11713!art7_cpt_inc2_ali3
"ALI","decreto_11713_2023, Art. 7º, caput, Inciso II, Alínea d",128,129,"[ Institui a Estratégia Nacional de Escolas Conectadas. | Art. 7º O Comitê Executivo é composto por: II – um representante dos seguintes órgãos e entidades: ] d) Fundo Nacional de Desenvolvimento da Educação - FNDE;",urn:lex:br:federal:decreto:2023-09-26;11713!art7_cpt_inc2_ali4
"ALI","decreto_11713_2023, Art. 7º, caput, Inciso II, Alínea e",130,131,"[ Institui a Estratégia Nacional de Escolas Conectadas. | Art. 7º O Comitê Executivo é composto por: II – um representante dos seguintes órgãos e entidades: ] e) Telecomunicações Brasileiras S.A. - Telebras;",urn:lex:br:federal:decreto:2023-09-26;11713!art7_cpt_inc2_ali5
"ALI","decreto_11713_2023, Art. 7º, caput, Inciso II, Alínea f",132,133,"[ Institui a Estratégia Nacional de Escolas Conectadas. | Art. 7º O Comitê Executivo é composto por: II – um representante dos seguintes órgãos e entidades: ] f) Banco Nacional de Desenvolvimento Econômico e Social - BNDES; e",urn:lex:br:federal:decreto:2023-09-26;11713!art7_cpt_inc2_ali6
"ALI","decreto_11713_2023, Art. 7º, caput, Inciso II, Alínea g",134,135,"[ Institui a Estratégia Nacional de Escolas Conectadas. | Art. 7º O Comitê Executivo é composto por: II – um representante dos seguintes órgãos e entidades: ] g) Rede Nacional de Ensino e Pesquisa - RNP.",urn:lex:br:federal:decreto:2023-09-26;11713!art7_cpt_inc2_ali7
"ALI","decreto_11713_2023, Art. 12., § 1º, Inciso II, Alínea a",194,195,"[ Institui a Estratégia Nacional de Escolas Conectadas. | Art. 12. § 1º No ato de adesão à Enec, o ente federativo deverá: II – firmar termo de compromisso, por meio do qual se comprometerá a: ] a) atender ao disposto no art. 3º e aos parâmetros técnicos definidos pelo Comitê Executivo nas suas políticas de conectividade para fins educacionais; e",urn:lex:br:federal:decreto:2023-09-26;11713!art12_par1_inc2_ali1
"ALI","decreto_11713_2023, Art. 12., § 1º, Inciso II, Alínea b",196,197,"[ Institui a Estratégia Nacional de Escolas Conectadas. | Art. 12. § 1º No ato de adesão à Enec, o ente federativo deverá: II – firmar termo de compromisso, por meio do qual se comprometerá a: ] b) anuir com a execução de ações para garantia da conectividade para fins educacionais nos seus estabelecimentos de ensino da rede pública da educação básica por meio de programas apoiados tecnicamente ou financeiramente pelo Governo federal.",urn:lex:br:federal:decreto:2023-09-26;11713!art12_par1_inc2_ali2
