Tipo,Rotulo,Num_Inicio,Num_Final,Texto,urn
"CPT","decreto_11713_2023, Art. 1º, caput",2,3,"[ Institui a Estratégia Nacional de Escolas Conectadas. | ] Fica instituída a Estratégia Nacional de Escolas Conectadas - Enec, com a finalidade de articular ações para universalizar a conectividade de qualidade para uso pedagógico e administrativo nos estabelecimentos de ensino da rede pública da educação básica.",urn:lex:br:federal:decreto:2023-09-26;11713!art1_cpt
"PAR","decreto_11713_2023, Art. 1º, Parágrafo único.",4,23,"[ Institui a Estratégia Nacional de Escolas Conectadas. | ] A Enec considerará as dimensões de infraestrutura e equipamentos previstas: nos seguintes dispositivos da Lei nº 9.394, de 20 de dezembro de 1996: inciso IX do caput do art. 3º; inciso XII do caput do art. 4º; e art. 8º; no § 2º do art. 1º da Lei nº 9.998, de 17 de agosto de 2000; nas estratégias 7.15 e 7.20 da meta 7 do Anexo à Lei nº 13.005, de 25 de junho de 2014; na Lei nº 14.172, de 10 de junho de 2021; na Lei nº 14.180, de 1º de julho de 2021; e no inciso VI do caput do art. 2º da Lei nº 14.533, de 11 de janeiro de 2023.",urn:lex:br:federal:decreto:2023-09-26;11713!art1_par1u
"CPT","decreto_11713_2023, Art. 2º, caput",26,33,"[ Institui a Estratégia Nacional de Escolas Conectadas. | ] A Enec visa conjugar esforços de órgãos e entidades da União, dos Estados, do Distrito Federal e dos Municípios, de escolas, do setor empresarial e da sociedade civil para a consecução dos seguintes objetivos: promover a universalização da conectividade de estabelecimentos de ensino da rede pública da educação básica; fomentar a equidade de oportunidades de acesso às tecnologias digitais no processo de ensino e aprendizagem; e contribuir com a aprendizagem digital e com o aperfeiçoamento da gestão por meio da ampliação do acesso à internet e às tecnologias digitais pelos estudantes, pelos professores e pelos gestores da rede pública de educação básica.",urn:lex:br:federal:decreto:2023-09-26;11713!art2_cpt
"CPT","decreto_11713_2023, Art. 3º, caput",36,63,"[ Institui a Estratégia Nacional de Escolas Conectadas. | ] A conectividade de estabelecimentos de ensino da rede pública da educação básica contemplará: conexão em alta velocidade que permita: a realização de atividades pedagógicas e administrativas online; o uso de recursos educacionais e de gestão; e o acesso a áudios, vídeos, jogos e plataformas de streaming; disponibilidade de rede sem fio no ambiente escolar, composto por: salas de aula; bibliotecas; laboratórios; salas de professores; áreas comuns; e áreas administrativas; disponibilidade de ferramentas para seu monitoramento constante e para garantia da segurança da informação; e disponibilidade de equipamentos e dispositivos de acesso à internet adequados para fins administrativos e educacionais.",urn:lex:br:federal:decreto:2023-09-26;11713!art3_cpt
"PAR","decreto_11713_2023, Art. 3º, Parágrafo único.",64,79,"[ Institui a Estratégia Nacional de Escolas Conectadas. | ] Para garantir a conectividade de que trata o caput, serão adotadas as seguintes ações, sem prejuízo da adoção de medidas adicionais: disponibilização de energia elétrica por intermédio do acesso à rede pública de energia ou da instalação de tecnologias de energias renováveis; expansão da conexão à internet de alta velocidade por meio de implantação e manutenção de rede de fibra ótica, de conexão via satélite ou de outros serviços de acesso à internet de alta velocidade; contratação de serviços de acesso à internet de alta velocidade; disponibilização de rede sem fio para acesso à internet no ambiente escolar; disponibilização de equipamentos e dispositivos eletrônicos de acesso à internet; suporte técnico, monitoramento e manutenção dos dispositivos eletrônicos e das redes sem fio; e estímulo ao desenvolvimento de soluções inovadoras que auxiliem na consecução dos objetivos da Enec.",urn:lex:br:federal:decreto:2023-09-26;11713!art3_par1u
"CPT","decreto_11713_2023, Art. 4º, caput",82,83,"[ Institui a Estratégia Nacional de Escolas Conectadas. | ] A Enec será implementada de forma articulada a outras iniciativas destinadas ao fomento do uso pedagógico de tecnologias digitais e à inserção da educação digital na educação básica.",urn:lex:br:federal:decreto:2023-09-26;11713!art4_cpt
"CPT","decreto_11713_2023, Art. 5º, caput",86,87,"[ Institui a Estratégia Nacional de Escolas Conectadas. | ] As ações executadas no âmbito da Enec poderão complementar outras iniciativas de conectividade de estabelecimentos de ensino da rede pública da educação básica, com vistas a garantir a consecução das metas e dos parâmetros técnicos de conectividade estabelecidos pelo Comitê Executivo de que trata o art. 6º.",urn:lex:br:federal:decreto:2023-09-26;11713!art5_cpt
"CPT","decreto_11713_2023, Art. 6º, caput",90,91,"[ Institui a Estratégia Nacional de Escolas Conectadas. | ] Fica instituído o Comitê Executivo da Estratégia Nacional de Escolas Conectadas.",urn:lex:br:federal:decreto:2023-09-26;11713!art6_cpt
"PAR","decreto_11713_2023, Art. 6º, § 1º",92,107,"[ Institui a Estratégia Nacional de Escolas Conectadas. | ] Ao Comitê Executivo compete: articular as políticas, os planos, os programas, as iniciativas e a disponibilização de recursos relacionados à conectividade de estabelecimentos de ensino da rede pública da educação básica; estabelecer metas para a consecução dos objetivos da Enec; definir e publicizar parâmetros técnicos para contratação, gestão e manutenção dos serviços de fornecimento de energia elétrica e de acesso à internet; definir e publicizar referenciais técnicos sobre a infraestrutura interna para distribuição do sinal de internet nos estabelecimentos de ensino da rede pública da educação básica; definir critérios e mecanismos de monitoramento da qualidade da conexão nos estabelecimentos de ensino da rede pública da educação básica; monitorar as iniciativas e avaliar os resultados das ações da Enec; e monitorar a conectividade de estabelecimentos de ensino da rede pública da educação básica.",urn:lex:br:federal:decreto:2023-09-26;11713!art6_par1
"PAR","decreto_11713_2023, Art. 6º, § 2º",108,109,"[ Institui a Estratégia Nacional de Escolas Conectadas. | ] As metas e os documentos técnicos aprovados pelo Comitê Executivo servirão como referência para a atuação dos órgãos e colegiados relacionados ao objeto deste Decreto, especialmente do Grupo de Acompanhamento do Custeio a Projetos de Conectividade de Escolas e do Conselho Gestor do Fundo de Universalização dos Serviços de Telecomunicações.",urn:lex:br:federal:decreto:2023-09-26;11713!art6_par2
"CPT","decreto_11713_2023, Art. 7º, caput",112,137,"[ Institui a Estratégia Nacional de Escolas Conectadas. | ] O Comitê Executivo é composto por: dois representantes dos seguintes órgãos: Ministério da Educação, um dos quais o coordenará; Casa Civil da Presidência da República; e Ministério das Comunicações; e um representante dos seguintes órgãos e entidades: Ministério da Ciência, Tecnologia e Inovação; Ministério de Minas e Energia; Agência Nacional de Telecomunicações - Anatel; Fundo Nacional de Desenvolvimento da Educação - FNDE; Telecomunicações Brasileiras S.A. - Telebras; Banco Nacional de Desenvolvimento Econômico e Social - BNDES; e Rede Nacional de Ensino e Pesquisa - RNP.",urn:lex:br:federal:decreto:2023-09-26;11713!art7_cpt
"PAR","decreto_11713_2023, Art. 7º, § 1º",138,139,"[ Institui a Estratégia Nacional de Escolas Conectadas. | ] Cada membro do Comitê Executivo terá um suplente, que o substituirá em suas ausências e seus impedimentos.",urn:lex:br:federal:decreto:2023-09-26;11713!art7_par1
"PAR","decreto_11713_2023, Art. 7º, § 2º",140,141,"[ Institui a Estratégia Nacional de Escolas Conectadas. | ] Os membros do Comitê Executivo e os respectivos suplentes serão indicados pelos titulares dos órgãos e entidades que representam e designados em ato do Ministro de Estado da Educação.",urn:lex:br:federal:decreto:2023-09-26;11713!art7_par2
"PAR","decreto_11713_2023, Art. 7º, § 3º",142,143,"[ Institui a Estratégia Nacional de Escolas Conectadas. | ] O Comitê Executivo poderá convidar representantes de outros órgãos e entidades, públicos e privados, e especialistas de notório conhecimento para participar de suas reuniões, sem direito a voto.",urn:lex:br:federal:decreto:2023-09-26;11713!art7_par3
"PAR","decreto_11713_2023, Art. 7º, § 4º",144,149,"[ Institui a Estratégia Nacional de Escolas Conectadas. | ] O Comitê Executivo poderá instituir grupos de trabalho temporários com o objetivo de: analisar e articular soluções para assuntos específicos relacionados à matéria; e desenvolver projetos e atividades acerca da conectividade por qualquer um de seus membros.",urn:lex:br:federal:decreto:2023-09-26;11713!art7_par4
"PAR","decreto_11713_2023, Art. 7º, § 5º",150,151,"[ Institui a Estratégia Nacional de Escolas Conectadas. | ] O Comitê Executivo se reunirá, em caráter ordinário, bimestralmente e, em caráter extraordinário, mediante solicitação de qualquer um de seus membros e convocação do seu Coordenador.",urn:lex:br:federal:decreto:2023-09-26;11713!art7_par5
"PAR","decreto_11713_2023, Art. 7º, § 6º",152,153,"[ Institui a Estratégia Nacional de Escolas Conectadas. | ] A participação no Comitê Executivo será considerada prestação de serviço público relevante, não remunerada.",urn:lex:br:federal:decreto:2023-09-26;11713!art7_par6
"PAR","decreto_11713_2023, Art. 7º, § 7º",154,161,"[ Institui a Estratégia Nacional de Escolas Conectadas. | ] O quórum de reunião do Comitê Executivo é de maioria absoluta, observada a obrigatoriedade de presença de um representante dos seguintes órgãos: Casa Civil da Presidência da República; Ministério das Comunicações; e Ministério da Educação.",urn:lex:br:federal:decreto:2023-09-26;11713!art7_par7
"PAR","decreto_11713_2023, Art. 7º, § 8º",162,163,"[ Institui a Estratégia Nacional de Escolas Conectadas. | ] O quórum de aprovação do Comitê Executivo é de maioria simples.",urn:lex:br:federal:decreto:2023-09-26;11713!art7_par8
"PAR","decreto_11713_2023, Art. 7º, § 9º",164,165,"[ Institui a Estratégia Nacional de Escolas Conectadas. | ] A Secretaria-Executiva do Comitê Executivo será exercida pelo Ministério da Educação.",urn:lex:br:federal:decreto:2023-09-26;11713!art7_par9
"PAR","decreto_11713_2023, Art. 7º, § 10.",166,167,"[ Institui a Estratégia Nacional de Escolas Conectadas. | ] Os membros do Comitê Executivo que se encontrarem no Distrito Federal se reunirão presencialmente ou por videoconferência e os membros que se encontrarem em outros entes federativos participarão da reunião por meio de videoconferência.",urn:lex:br:federal:decreto:2023-09-26;11713!art7_par10
"PAR","decreto_11713_2023, Art. 7º, § 11.",168,169,"[ Institui a Estratégia Nacional de Escolas Conectadas. | ] Os membros do Comitê Executivo não farão jus ao pagamento de diárias ou passagens.",urn:lex:br:federal:decreto:2023-09-26;11713!art7_par11
"CPT","decreto_11713_2023, Art. 8º, caput",172,173,"[ Institui a Estratégia Nacional de Escolas Conectadas. | ] O Comitê Executivo publicará anualmente relatório sobre os resultados obtidos pela Enec.",urn:lex:br:federal:decreto:2023-09-26;11713!art8_cpt
"CPT","decreto_11713_2023, Art. 9º, caput",176,177,"[ Institui a Estratégia Nacional de Escolas Conectadas. | ] Compete à Casa Civil da Presidência da República acompanhar a implementação da Enec.",urn:lex:br:federal:decreto:2023-09-26;11713!art9_cpt
"CPT","decreto_11713_2023, Art. 10., caput",180,181,"[ Institui a Estratégia Nacional de Escolas Conectadas. | ] Compete ao Ministério das Comunicações propor ao Comitê Executivo parâmetros para a escolha das soluções de conectividade mais eficientes, com o apoio técnico da Anatel, da Telebras e da RNP, com avaliação das alternativas tecnológicas e comerciais disponíveis que melhor se adaptem às diferentes situações dos estabelecimentos de ensino da rede pública da educação básica que serão atendidos no âmbito da Enec.",urn:lex:br:federal:decreto:2023-09-26;11713!art10_cpt
"CPT","decreto_11713_2023, Art. 11., caput",184,185,"[ Institui a Estratégia Nacional de Escolas Conectadas. | ] Compete ao Ministério da Educação articular e coordenar as ações necessárias à consecução dos objetivos da Enec junto aos Estados, ao Distrito Federal e aos Municípios.",urn:lex:br:federal:decreto:2023-09-26;11713!art11_cpt
"CPT","decreto_11713_2023, Art. 12., caput",188,189,"[ Institui a Estratégia Nacional de Escolas Conectadas. | ] Os Estados, o Distrito Federal e os Municípios poderão aderir voluntariamente à Enec por meio da celebração de ato com o Ministério da Educação.",urn:lex:br:federal:decreto:2023-09-26;11713!art12_cpt
"PAR","decreto_11713_2023, Art. 12., § 1º",190,199,"[ Institui a Estratégia Nacional de Escolas Conectadas. | ] No ato de adesão à Enec, o ente federativo deverá: apresentar diagnóstico que contenha informações sobre a situação atualizada, as ações, as políticas e os programas existentes para a conectividade para fins educacionais, conforme previsto no art. 2º; e firmar termo de compromisso, por meio do qual se comprometerá a: atender ao disposto no art. 3º e aos parâmetros técnicos definidos pelo Comitê Executivo nas suas políticas de conectividade para fins educacionais; e anuir com a execução de ações para garantia da conectividade para fins educacionais nos seus estabelecimentos de ensino da rede pública da educação básica por meio de programas apoiados tecnicamente ou financeiramente pelo Governo federal.",urn:lex:br:federal:decreto:2023-09-26;11713!art12_par1
"PAR","decreto_11713_2023, Art. 12., § 2º",200,201,"[ Institui a Estratégia Nacional de Escolas Conectadas. | ] Os entes federativos que se vincularem à Enec serão priorizados nas ações e nos programas do Governo federal relacionados à conectividade de estabelecimentos de ensino da rede pública da educação básica.",urn:lex:br:federal:decreto:2023-09-26;11713!art12_par2
"CPT","decreto_11713_2023, Art. 13., caput",204,209,"[ Institui a Estratégia Nacional de Escolas Conectadas. | ] Os entes federativos que aderirem à Enec deverão: instalar e manter em funcionamento o sistema denominado Medidor Educação Conectada ou outro que venha a ser indicado pelo Ministério da Educação; e disponibilizar as informações necessárias ao monitoramento de que trata este Decreto.",urn:lex:br:federal:decreto:2023-09-26;11713!art13_cpt
"CPT","decreto_11713_2023, Art. 14., caput",212,213,"[ Institui a Estratégia Nacional de Escolas Conectadas. | ] A implementação da Enec poderá abranger a conectividade de equipamentos sociais relacionados a outras atividades, especialmente a saúde pública.",urn:lex:br:federal:decreto:2023-09-26;11713!art14_cpt
"CPT","decreto_11713_2023, Art. 15., caput",216,227,"[ Institui a Estratégia Nacional de Escolas Conectadas. | ] Para o cumprimento do disposto neste Decreto, o Ministério da Educação ou o Ministério das Comunicações poderá celebrar, dentre outros: contratos de gestão; termos de parceria; acordos de cooperação; termos de fomento; ou termos de colaboração.",urn:lex:br:federal:decreto:2023-09-26;11713!art15_cpt
"PAR","decreto_11713_2023, Art. 15., Parágrafo único.",228,229,"[ Institui a Estratégia Nacional de Escolas Conectadas. | ] A celebração dos instrumentos de que trata o caput observará o disposto na Lei nº 9.637, de 15 de maio de 1998, na Lei nº 9.790, de 23 de março de 1999, na Lei nº 13.019, de 31 de julho de 2014, e nas demais normas aplicáveis às espécies.",urn:lex:br:federal:decreto:2023-09-26;11713!art15_par1u
"CPT","decreto_11713_2023, Art. 16., caput",232,233,"[ Institui a Estratégia Nacional de Escolas Conectadas. | ] Ficam revogados os art. 8º e art. 9º do Decreto nº 9.204, de 23 de novembro de 2017.",urn:lex:br:federal:decreto:2023-09-26;11713!art16_cpt
"CPT","decreto_11713_2023, Art. 17., caput",236,237,"[ Institui a Estratégia Nacional de Escolas Conectadas. | ] Este Decreto entra em vigor na data de sua publicação.",urn:lex:br:federal:decreto:2023-09-26;11713!art17_cpt
"ART","decreto_11713_2023, Art. 1º",1,24,"[ Institui a Estratégia Nacional de Escolas Conectadas. | ] Art. 1º Fica instituída a Estratégia Nacional de Escolas Conectadas - Enec, com a finalidade de articular ações para universalizar a conectividade de qualidade para uso pedagógico e administrativo nos estabelecimentos de ensino da rede pública da educação básica. Parágrafo único. A Enec considerará as dimensões de infraestrutura e equipamentos previstas: I – nos seguintes dispositivos da Lei nº 9.394, de 20 de dezembro de 1996: a) inciso IX do caput do art. 3º; b) inciso XII do caput do art. 4º; e c) art. 8º; II – no § 2º do art. 1º da Lei nº 9.998, de 17 de agosto de 2000; III – nas estratégias 7.15 e 7.20 da meta 7 do Anexo à Lei nº 13.005, de 25 de junho de 2014; IV – na Lei nº 14.172, de 10 de junho de 2021; V – na Lei nº 14.180, de 1º de julho de 2021; e VI – no inciso VI do caput do art. 2º da Lei nº 14.533, de 11 de janeiro de 2023.",urn:lex:br:federal:decreto:2023-09-26;11713!art1
"ART","decreto_11713_2023, Art. 2º",25,34,"[ Institui a Estratégia Nacional de Escolas Conectadas. | ] Art. 2º A Enec visa conjugar esforços de órgãos e entidades da União, dos Estados, do Distrito Federal e dos Municípios, de escolas, do setor empresarial e da sociedade civil para a consecução dos seguintes objetivos: I – promover a universalização da conectividade de estabelecimentos de ensino da rede pública da educação básica; II – fomentar a equidade de oportunidades de acesso às tecnologias digitais no processo de ensino e aprendizagem; e III – contribuir com a aprendizagem digital e com o aperfeiçoamento da gestão por meio da ampliação do acesso à internet e às tecnologias digitais pelos estudantes, pelos professores e pelos gestores da rede pública de educação básica.",urn:lex:br:federal:decreto:2023-09-26;11713!art2
"ART","decreto_11713_2023, Art. 3º",35,80,"[ Institui a Estratégia Nacional de Escolas Conectadas. | ] Art. 3º A conectividade de estabelecimentos de ensino da rede pública da educação básica contemplará: I – conexão em alta velocidade que permita: a) a realização de atividades pedagógicas e administrativas online; b) o uso de recursos educacionais e de gestão; e c) o acesso a áudios, vídeos, jogos e plataformas de streaming; II – disponibilidade de rede sem fio no ambiente escolar, composto por: a) salas de aula; b) bibliotecas; c) laboratórios; d) salas de professores; e) áreas comuns; e f) áreas administrativas; III – disponibilidade de ferramentas para seu monitoramento constante e para garantia da segurança da informação; e IV – disponibilidade de equipamentos e dispositivos de acesso à internet adequados para fins administrativos e educacionais. Parágrafo único. Para garantir a conectividade de que trata o caput, serão adotadas as seguintes ações, sem prejuízo da adoção de medidas adicionais: I – disponibilização de energia elétrica por intermédio do acesso à rede pública de energia ou da instalação de tecnologias de energias renováveis; II – expansão da conexão à internet de alta velocidade por meio de implantação e manutenção de rede de fibra ótica, de conexão via satélite ou de outros serviços de acesso à internet de alta velocidade; III – contratação de serviços de acesso à internet de alta velocidade; IV – disponibilização de rede sem fio para acesso à internet no ambiente escolar; V – disponibilização de equipamentos e dispositivos eletrônicos de acesso à internet; VI – suporte técnico, monitoramento e manutenção dos dispositivos eletrônicos e das redes sem fio; e VII – estímulo ao desenvolvimento de soluções inovadoras que auxiliem na consecução dos objetivos da Enec.",urn:lex:br:federal:decreto:2023-09-26;11713!art3
"ART","decreto_11713_2023, Art. 4º",81,84,"[ Institui a Estratégia Nacional de Escolas Conectadas. | ] Art. 4º A Enec será implementada de forma articulada a outras iniciativas destinadas ao fomento do uso pedagógico de tecnologias digitais e à inserção da educação digital na educação básica.",urn:lex:br:federal:decreto:2023-09-26;11713!art4
"ART","decreto_11713_2023, Art. 5º",85,88,"[ Institui a Estratégia Nacional de Escolas Conectadas. | ] Art. 5º As ações executadas no âmbito da Enec poderão complementar outras iniciativas de conectividade de estabelecimentos de ensino da rede pública da educação básica, com vistas a garantir a consecução das metas e dos parâmetros técnicos de conectividade estabelecidos pelo Comitê Executivo de que trata o art. 6º.",urn:lex:br:federal:decreto:2023-09-26;11713!art5
"ART","decreto_11713_2023, Art. 6º",89,110,"[ Institui a Estratégia Nacional de Escolas Conectadas. | ] Art. 6º Fica instituído o Comitê Executivo da Estratégia Nacional de Escolas Conectadas. § 1º Ao Comitê Executivo compete: I – articular as políticas, os planos, os programas, as iniciativas e a disponibilização de recursos relacionados à conectividade de estabelecimentos de ensino da rede pública da educação básica; II – estabelecer metas para a consecução dos objetivos da Enec; III – definir e publicizar parâmetros técnicos para contratação, gestão e manutenção dos serviços de fornecimento de energia elétrica e de acesso à internet; IV – definir e publicizar referenciais técnicos sobre a infraestrutura interna para distribuição do sinal de internet nos estabelecimentos de ensino da rede pública da educação básica; V – definir critérios e mecanismos de monitoramento da qualidade da conexão nos estabelecimentos de ensino da rede pública da educação básica; VI – monitorar as iniciativas e avaliar os resultados das ações da Enec; e VII – monitorar a conectividade de estabelecimentos de ensino da rede pública da educação básica. § 2º As metas e os documentos técnicos aprovados pelo Comitê Executivo servirão como referência para a atuação dos órgãos e colegiados relacionados ao objeto deste Decreto, especialmente do Grupo de Acompanhamento do Custeio a Projetos de Conectividade de Escolas e do Conselho Gestor do Fundo de Universalização dos Serviços de Telecomunicações.",urn:lex:br:federal:decreto:2023-09-26;11713!art6
"ART","decreto_11713_2023, Art. 7º",111,170,"[ Institui a Estratégia Nacional de Escolas Conectadas. | ] Art. 7º O Comitê Executivo é composto por: I – dois representantes dos seguintes órgãos: a) Ministério da Educação, um dos quais o coordenará; b) Casa Civil da Presidência da República; e c) Ministério das Comunicações; e II – um representante dos seguintes órgãos e entidades: a) Ministério da Ciência, Tecnologia e Inovação; b) Ministério de Minas e Energia; c) Agência Nacional de Telecomunicações - Anatel; d) Fundo Nacional de Desenvolvimento da Educação - FNDE; e) Telecomunicações Brasileiras S.A. - Telebras; f) Banco Nacional de Desenvolvimento Econômico e Social - BNDES; e g) Rede Nacional de Ensino e Pesquisa - RNP. § 1º Cada membro do Comitê Executivo terá um suplente, que o substituirá em suas ausências e seus impedimentos. § 2º Os membros do Comitê Executivo e os respectivos suplentes serão indicados pelos titulares dos órgãos e entidades que representam e designados em ato do Ministro de Estado da Educação. § 3º O Comitê Executivo poderá convidar representantes de outros órgãos e entidades, públicos e privados, e especialistas de notório conhecimento para participar de suas reuniões, sem direito a voto. § 4º O Comitê Executivo poderá instituir grupos de trabalho temporários com o objetivo de: I – analisar e articular soluções para assuntos específicos relacionados à matéria; e II – desenvolver projetos e atividades acerca da conectividade por qualquer um de seus membros. § 5º O Comitê Executivo se reunirá, em caráter ordinário, bimestralmente e, em caráter extraordinário, mediante solicitação de qualquer um de seus membros e convocação do seu Coordenador. § 6º A participação no Comitê Executivo será considerada prestação de serviço público relevante, não remunerada. § 7º O quórum de reunião do Comitê Executivo é de maioria absoluta, observada a obrigatoriedade de presença de um representante dos seguintes órgãos: I – Casa Civil da Presidência da República; II – Ministério das Comunicações; e III – Ministério da Educação. § 8º O quórum de aprovação do Comitê Executivo é de maioria simples. § 9º A Secretaria-Executiva do Comitê Executivo será exercida pelo Ministério da Educação. § 10. Os membros do Comitê Executivo que se encontrarem no Distrito Federal se reunirão presencialmente ou por videoconferência e os membros que se encontrarem em outros entes federativos participarão da reunião por meio de videoconferência. § 11. Os membros do Comitê Executivo não farão jus ao pagamento de diárias ou passagens.",urn:lex:br:federal:decreto:2023-09-26;11713!art7
"ART","decreto_11713_2023, Art. 8º",171,174,"[ Institui a Estratégia Nacional de Escolas Conectadas. | ] Art. 8º O Comitê Executivo publicará anualmente relatório sobre os resultados obtidos pela Enec.",urn:lex:br:federal:decreto:2023-09-26;11713!art8
